{
  "schemaVersion": "1.0",
  "kind": "device-dynamic-group-proposal-fixture",
  "tenantId": "11111111-1111-1111-1111-111111111111",
  "source": {
    "type": "DefenderMachines",
    "collectionState": "Complete",
    "collectedAtUtc": "2026-10-13T12:00:00Z",
    "sha256": "bbbbbbbbbbbbbbbbbbbbbbbbbbbbbbbbbbbbbbbbbbbbbbbbbbbbbbbbbbbbbbbb",
    "records": [
      {
        "id": "aaaaaaaaaaaaaaaaaaaaaaaaaaaaaaaaaaaaaaaa",
        "aadDeviceId": "33333333-3333-3333-3333-333333333333",
        "onboardingStatus": "CanBeOnboarded",
        "lastSeen": "2026-10-13T11:00:00Z"
      },
      {
        "id": "bbbbbbbbbbbbbbbbbbbbbbbbbbbbbbbbbbbbbbbb",
        "aadDeviceId": "66666666-6666-6666-6666-666666666666",
        "onboardingStatus": "onboarded",
        "lastSeen": "2026-10-13T11:00:00Z"
      }
    ]
  },
  "devices": [
    {
      "entraObjectId": "22222222-2222-2222-2222-222222222222",
      "deviceId": "33333333-3333-3333-3333-333333333333",
      "existingAttribute": {
        "number": 13,
        "value": "CanBeOnboarded",
        "owner": "fixture-admin/defender-onboarding",
        "observedAtUtc": "2026-10-13T12:00:00Z",
        "sourceSha256": "bbbbbbbbbbbbbbbbbbbbbbbbbbbbbbbbbbbbbbbbbbbbbbbbbbbbbbbbbbbbbbbb"
      }
    },
    {
      "entraObjectId": "55555555-5555-5555-5555-555555555555",
      "deviceId": "66666666-6666-6666-6666-666666666666",
      "existingAttribute": {
        "number": 13,
        "value": "onboarded",
        "owner": "fixture-admin/defender-onboarding",
        "observedAtUtc": "2026-10-13T12:00:00Z",
        "sourceSha256": "bbbbbbbbbbbbbbbbbbbbbbbbbbbbbbbbbbbbbbbbbbbbbbbbbbbbbbbbbbbbbbbb"
      }
    }
  ]
}
