{
  "schemaVersion": "1.0",
  "kind": "device-dynamic-group-proposal-fixture",
  "tenantId": "11111111-1111-1111-1111-111111111111",
  "source": {
    "type": "IntuneManagedDevices",
    "collectionState": "Complete",
    "collectedAtUtc": "2026-10-13T12:00:00Z",
    "sha256": "aaaaaaaaaaaaaaaaaaaaaaaaaaaaaaaaaaaaaaaaaaaaaaaaaaaaaaaaaaaaaaaa",
    "records": [
      {
        "id": "44444444-4444-4444-4444-444444444444",
        "azureADDeviceId": "33333333-3333-3333-3333-333333333333"
      }
    ]
  },
  "devices": [
    {
      "entraObjectId": "22222222-2222-2222-2222-222222222222",
      "deviceId": "33333333-3333-3333-3333-333333333333",
      "existingAttribute": {
        "number": 14,
        "value": "Fresh|2026-10-13T11:00:00Z",
        "owner": "fixture-admin/intune-state",
        "observedAtUtc": "2026-10-13T12:00:00Z",
        "sourceSha256": "aaaaaaaaaaaaaaaaaaaaaaaaaaaaaaaaaaaaaaaaaaaaaaaaaaaaaaaaaaaaaaaa"
      }
    },
    {
      "entraObjectId": "55555555-5555-5555-5555-555555555555",
      "deviceId": "66666666-6666-6666-6666-666666666666",
      "existingAttribute": {
        "number": 14,
        "value": "Unmanaged|none",
        "owner": "fixture-admin/intune-state",
        "observedAtUtc": "2026-10-13T12:00:00Z",
        "sourceSha256": "aaaaaaaaaaaaaaaaaaaaaaaaaaaaaaaaaaaaaaaaaaaaaaaaaaaaaaaaaaaaaaaa"
      }
    }
  ]
}
